institutionCode	recordedBy	state	county	distance_km	status	implied_location	coordinates	catalogNumber	locality	record_link
US	T. D. V. Swinscow	Florida	Dade	NA	county_not_matched_no_match	lookup_error	25.67,-80.27	NA	Coral Gables.	https://lichenportal.org/portal/collections/individual/index.php?occid=3591949
US	T. D. V. Swinscow	Florida	Dade	NA	county_not_matched_no_match	lookup_error	25.67,-80.27	NA	Coral Gables.	https://lichenportal.org/portal/collections/individual/index.php?occid=3373928
US	B. Ryan	Florida	Wakulia	NA	county_not_matched_no_match	lookup_error	30.2,-84.45	NA	Wakulia Co., ABLS Stop 5, Apalachicola Nationalalong Co. Rd. 368, 3.6 mi NW of jct. of US Hwy 319 at Crawfordville.	https://lichenportal.org/portal/collections/individual/index.php?occid=4768425
US	D. H. Goldman	Florida	Dade	NA	county_not_matched_no_match	lookup_error	0.3,-80.484361	NA	In front of house at 430 NW 14th Street, a few hundred feet W of the intersection with NW 4-th Avenue. Homestead, Miami	https://lichenportal.org/portal/collections/individual/index.php?occid=3606409
US	A. Tehler	Florida	Dade	NA	county_not_matched_no_match	lookup_error	25.67,-80.33	NA	Near Matheson Hammock Park, 10 km S of Miami	https://lichenportal.org/portal/collections/individual/index.php?occid=3606526
