institutionCode	recordedBy	state	county	distance_km	status	implied_location	coordinates	catalogNumber	locality	record_link
GMUF	Sam Shushan	Colorado	Boulder	811.14	outside_boundary_exact	Nevada, White Pine County	39.95833333,-115.2777778	GMUF-0016447	Mesa Trail, 3.2 km S of Boulder	https://lichenportal.org/portal/collections/individual/index.php?occid=3564622
GMUF	Sam Shushan	Colorado	Summit	0.34	outside_boundary_exact	Colorado, Summit County	39.65,-105.85	GMUF-0016623	Northeast of Loveland Pass; 32.2 km W SW of Idaho Springs	https://lichenportal.org/portal/collections/individual/index.php?occid=3570026
GMUF	Sam Shushan	Colorado	Summit	0.34	outside_boundary_exact	Colorado, Summit County	39.65,-105.85	GMUF-0016611	Northeast of Loveland Pass; 32.2 km W SW of Idaho Springs	https://lichenportal.org/portal/collections/individual/index.php?occid=3570028
GMUF	Sam Shushan	Colorado	Larimer	0.24	outside_boundary_exact	Wyoming, Albany County	41,-105.3666667	GMUF-0016441	0.8 km S of Wyoming state line (just N of Virginia Dale)	https://lichenportal.org/portal/collections/individual/index.php?occid=3564600
GMUF	Sam Shushan	Colorado	Larimer	0.24	outside_boundary_exact	Wyoming, Albany County	41,-105.3666667	GMUF-0016483	Ca. 0.8 km S of the Wyoming state line (just north of Virginia Dale)	https://lichenportal.org/portal/collections/individual/index.php?occid=3566704
