institutionCode	recordedBy	state	county	distance_km	status	implied_location	coordinates	catalogNumber	locality	record_link
F	S. Leavitt	Utah	Juab	688.82	outside_boundary_exact	location_lookup_error	39.77748,-122.11604	C1001664F	Hot Springs Creek	https://lichenportal.org/portal/collections/individual/index.php?occid=3049148
BRY	Steven D. Leavitt	Utah	Daggett	90.69	outside_boundary_exact	location_lookup_error	40.204115,-110.71335	BRY-L-0023756	Uinta Mountains: Pinyon Ridge Rest Stop on Rt. 40, vicinity of Starvation State Park and Starvation Reservoir (about 7 miles west of park boundary), vicinity of Duschene (about 13 miles west of town). Stop 1 collections made in conjunction with the Snowbird ABLS Uinta Mountains field trip.	https://lichenportal.org/portal/collections/individual/index.php?occid=1832277
UPS	Steven D. Leavitt	Utah	Uintah Co.	3.55	outside_boundary_exact	location_lookup_error	40.80672,-110.01862	L-522515	Uintah Co., Ashley National Forest, vicinity of Walkup Lake, about 1.6 km E	https://lichenportal.org/portal/collections/individual/index.php?occid=971519
ASU	Steven D. Leavitt	Utah	Uintah	3.55	outside_boundary_exact	location_lookup_error	40.80672,-110.01862		Ashley National Forest, vicinity of Walkup Lake, about 1.6 km east	https://lichenportal.org/portal/collections/individual/index.php?occid=2697656
WIS	Steven D. Leavitt	Utah	Uintah Co.	3.55	outside_boundary_exact	location_lookup_error	40.80672,-110.01862	WIS-L-0108537	Uintah Co., Ashley National Forest, vicinity of Walkup Lake, about 1.6 km E	https://lichenportal.org/portal/collections/individual/index.php?occid=1476812
BRY	Steven D. Leavitt	Utah	Boulder	NA	county_not_matched_no_match	county_not_matched	33.925,-109.516667	BRY-L-0017076	Boulder Mountain Park: Northwest of Boulder Mountain, along Boulder Mountain Road, 8.7 km from SR 24 (land managed by the Bureau of Land Management).	https://lichenportal.org/portal/collections/individual/index.php?occid=1343813
