occurrenceID	institutionCode	recordedBy	stateProvince	county	distance_km	status	catalogNumber	coordinates	implied_location	locality	record_link
2690390	PH	James P Schuster	Minnesota	Big Stone	4943.45	outside_boundary_exact	PH00146955	56.725281,-27.645253	not_found_in_US	Big Stone Lake State Park/Bonanza Prairie SNA.Ortonville: 14 mi NW, on W-facing slope of valley containing Big Stone Lake.	https://lichenportal.org/portal/collections/individual/index.php?occid=2690390
1725437	PH	C. M. Wetmore	Minnesota	Hubbard	50.38	outside_boundary_exact	PH00090529	47,-94	Minnesota, Cass County	One mile north of Lake George in jack pine area.	https://lichenportal.org/portal/collections/individual/index.php?occid=1725437
1091587	PH	Wetmore, C.M.	Minnesota	Hubbard	50.38	outside_boundary_exact	PH00045372	47,-94	Minnesota, Cass County	One mile north of Lake George in jack pine area	https://lichenportal.org/portal/collections/individual/index.php?occid=1091587
1795565	PH	Clifford M. Wetmore	Minnesota	Saint Louis	6.36	outside_boundary_standardized_exact	PH00115891	48.55,-92.55	not_found_in_US	large island on north side of Hitchcock Bay in Rainy Lake, Voyageurs National Park	https://lichenportal.org/portal/collections/individual/index.php?occid=1795565
1795568	PH	Clifford M. Wetmore	Minnesota	Saint Louis	6.36	outside_boundary_standardized_exact	PH00115894	48.55,-92.55	not_found_in_US	Voyageurs National Park. Large island on north side of Hitchcock Bay in Rainy Lake	https://lichenportal.org/portal/collections/individual/index.php?occid=1795568
1795409	PH	Clifford M. Wetmore	Minnesota	Chisago	0.01	outside_boundary_exact	PH00115735	45.316667,-92.716667	Wisconsin, Polk County	half mile [0.8 km] west of St. Croix River on road to Osceola, Wisc. (6 miles [9.6 km] south of Taylors Falls)	https://lichenportal.org/portal/collections/individual/index.php?occid=1795409
1795411	PH	Clifford M. Wetmore	Minnesota	Chisago	0.01	outside_boundary_exact	PH00115737	45.31667,-92.71667	Wisconsin, Polk County	half mile [0.8 km] west of St. Croix River on road to Osceola, Wisc. (6 miles [9.6 km] south of Taylors Falls)	https://lichenportal.org/portal/collections/individual/index.php?occid=1795411
