occurrenceID	institutionCode	recordedBy	stateProvince	county	distance_km	status	catalogNumber	coordinates	implied_location	locality	record_link
2690361	PH	Clifford M Wetmore	New Mexico	Otero	6792.68	outside_boundary_exact	PH00146943	50.47861,-23.12903	not_found_in_US	Lincoln National Forest near Cloudcroft above The Pines Campground. On N-facing slope	https://lichenportal.org/portal/collections/individual/index.php?occid=2690361
2690386	PH	Clifford M Wetmore	New Mexico	Otero	6792.68	outside_boundary_exact	PH00146952	50.47861,-23.12903	not_found_in_US	Lincoln National Forest, near Cloudcroft, above The Pines Campground. On N-facing slope.	https://lichenportal.org/portal/collections/individual/index.php?occid=2690386
1744590	PH	J. Marsh	New Mexico	San Juan	80.53	outside_boundary_exact	PH00102684	36.61667,-106.61667	New Mexico, Rio Arriba County	H44	https://lichenportal.org/portal/collections/individual/index.php?occid=1744590
2689466	PH	Robert S. Egan	New Mexico	Guadalupe	26.49	outside_boundary_exact	PH00146933	35.400536,-105.475844	New Mexico, San Miguel County	Las Vegas: S	https://lichenportal.org/portal/collections/individual/index.php?occid=2689466
4818492	PH	R. D. Worthington	New Mexico	Lincoln	2.27	outside_boundary_exact	PH00792373	33.37,-105.793333	New Mexico, Otero County	White Mountains, Lincoln National Forest, Tanbark Canyon system near Skull Spring and 0.3 mi. NW go Parons' Mine (T9S, R11E, ctr. See 34)	https://lichenportal.org/portal/collections/individual/index.php?occid=4818492
