institutionCode	recordedBy	state	county	distance_km	status	implied_location	coordinates	catalogNumber	locality	record_link
COLO	Clifford M. Wetmore	Michigan	Lake	563.1	outside_boundary_exact	Minnesota, Lake County	47.810669,-91.097001	COLO-L-0013585	Two miles S. of Kawishiwi Lake, 25 miles NW of Tofte	https://lichenportal.org/portal/collections/individual/index.php?occid=1629017
COLO	Clifford M. Wetmore	Michigan	Houghton	437.62	outside_boundary_exact	Minnesota, Stearns County	45.6166667,-94.5166667	COLO-L-0026685	Upper entrance to Keweenaw Waterway, on west side of channel	https://lichenportal.org/portal/collections/individual/index.php?occid=1684812
COLO	Thomas H. Nash III	Michigan	Keweenaw	41.91	outside_boundary_exact	Michigan, Houghton County	46.95,-88.7666667	COLO-L-0009010	Mount Franklin, at the center of Isle Royale	https://lichenportal.org/portal/collections/individual/index.php?occid=1617923
COLO	Thomas H. Nash III	Michigan	Keweenaw	41.91	outside_boundary_exact	Michigan, Houghton County	46.95,-88.7666667	COLO-L-0030461	top of Mount Franklin, at the center of Isle Royale	https://lichenportal.org/portal/collections/individual/index.php?occid=1689603
COLO	Thomas H. Nash III	Michigan	Keweenaw	41.91	outside_boundary_exact	Michigan, Houghton County	46.95,-88.7666667	COLO-L-0045341	top of Mount Franklin, at the center of Isle Royale	https://lichenportal.org/portal/collections/individual/index.php?occid=1730219
