institutionCode	recordedBy	state	county	distance_km	status	implied_location	coordinates	catalogNumber	locality	record_link
PH	Clifford M Wetmore	New Mexico	Otero	6792.68	outside_boundary_exact	not_found_in_US	50.47861,-23.12903	PH00146943	Lincoln National Forest near Cloudcroft above The Pines Campground. On N-facing slope	https://lichenportal.org/portal/collections/individual/index.php?occid=2690361
PH	Clifford M Wetmore	New Mexico	Otero	6792.68	outside_boundary_exact	not_found_in_US	50.47861,-23.12903	PH00146952	Lincoln National Forest, near Cloudcroft, above The Pines Campground. On N-facing slope.	https://lichenportal.org/portal/collections/individual/index.php?occid=2690386
PH	J. Marsh	New Mexico	San Juan	80.53	outside_boundary_exact	New Mexico, Rio Arriba County	36.61667,-106.61667	PH00102684	H44	https://lichenportal.org/portal/collections/individual/index.php?occid=1744590
PH	Robert S. Egan	New Mexico	Guadalupe	26.49	outside_boundary_exact	New Mexico, San Miguel County	35.400536,-105.475844	PH00146933	Las Vegas: S	https://lichenportal.org/portal/collections/individual/index.php?occid=2689466
PH	R. D. Worthington	New Mexico	Lincoln	2.27	outside_boundary_exact	New Mexico, Otero County	33.37,-105.793333	PH00792373	White Mountains, Lincoln National Forest, Tanbark Canyon system near Skull Spring and 0.3 mi. NW go Parons' Mine (T9S, R11E, ctr. See 34)	https://lichenportal.org/portal/collections/individual/index.php?occid=4818492
