institutionCode	recordedBy	state	county	distance_km	status	implied_location	coordinates	catalogNumber	locality	record_link
WIS	Wade T. Batson	South Carolina	Saluda	118.61	outside_boundary_exact	South Carolina, Sumter County	33.894503,-80.197792	WIS-L-0065595	adjacent Hwy. 378	https://lichenportal.org/portal/collections/individual/index.php?occid=1245225
WIS	G. T. Johnson	South Carolina	Horry	2.29	outside_boundary_exact	South Carolina, Georgetown County	33.551002,-79.041426	WIS-L-0020431	Near Murrels Inlet.	https://lichenportal.org/portal/collections/individual/index.php?occid=1017638
WIS	F.W.G. (F.W. Gray)	South Carolina	Horry	1.29	outside_boundary_exact	South Carolina, Marion County	34.233775,-79.14865	WIS-L-0028000	Nichols, but in Horry Co.	https://lichenportal.org/portal/collections/individual/index.php?occid=1053705
WIS	Fred W. Gray	South Carolina	Horry	1.29	outside_boundary_exact	South Carolina, Marion County	34.233775,-79.14865	WIS-L-0035535	Nichols	https://lichenportal.org/portal/collections/individual/index.php?occid=1069467
WIS	Hugh H. Iltis	South Carolina	Horry	0.23	outside_boundary_exact	South Carolina, Horry County	33.835423,-79.257815	WIS-L-0036661	just east of Little Pee Dee River along Hwy. 378 about 10 mi. W of Conway.	https://lichenportal.org/portal/collections/individual/index.php?occid=1070703
WIS	Hugh H. ltis	South Carolina	Horry	0.23	outside_boundary_exact	South Carolina, Horry County	33.835423,-79.257815	WIS-L-0083564	just east of Little Pee Dee River, along Hwy. 378 about 10 mi. W of Conway.	https://lichenportal.org/portal/collections/individual/index.php?occid=2410966
WIS	A.J. Sharp	South Carolina	Pickens	0.01	outside_boundary_exact	South Carolina, Pickens County	34.976485,-82.934033	WIS-L-0093554	S slope Whitewater River Gorge	https://lichenportal.org/portal/collections/individual/index.php?occid=1366960
