occurrenceID	institutionCode	recordedBy	stateProvince	county	distance_km	status	catalogNumber	coordinates	implied_location	locality	record_link
964396	NY	David C. Anderson	Utah	Millard	20.19	outside_boundary_exact	1394138	38.393306,-113.934951	Utah, Beaver County	Desert Range Experiment Station, about 50 miles, west of Milford, Utah.	https://lichenportal.org/portal/collections/individual/index.php?occid=964396
4951596	NY	L. L. St. Clair	Utah	Uintah Co.	3.86	outside_boundary_exact	4424015	40.7703,-110.0225	Utah, Duchesne County	Ashley National Forest, along USFS Road No. 110, 2.4 km south of Wigwam/Papoose Lake Trailhead (USFS Trail No. 129) parking area.	https://lichenportal.org/portal/collections/individual/index.php?occid=4951596
888881	NY	B. D. Ryan	Utah	Utah Co.	0.85	outside_boundary_exact	1221159	40.38,-111.55	Utah, Wasatch County	W side of Hwy 189, ca. 10 mi N of Provo	https://lichenportal.org/portal/collections/individual/index.php?occid=888881
844147	NY	W. R. Buck	Utah	Duchesne Co.	0.26	outside_boundary_exact	684191	40.6861111,-110.90055556	Utah, Duchesne County	Unita Mountains, Watatch National Forest, Bald Mountain Pass, E of UT 150, just NE of Summit County line	https://lichenportal.org/portal/collections/individual/index.php?occid=844147
843749	NY	W. R. Buck	Utah	Summit Co.	0.06	outside_boundary_exact	684163	40.6580556,-110.9463889	Utah, Summit County	Unita Mountains, Wasatch National Forest, Provo River Falls, W of UT 150	https://lichenportal.org/portal/collections/individual/index.php?occid=843749
843829	NY	W. R. Buck	Utah	Summit Co.	0.06	outside_boundary_exact	684178	40.6580556,-110.9463889	Utah, Summit County	Unita Mountains, Wasatch National Forest, Provo River Falls, W of UT 150	https://lichenportal.org/portal/collections/individual/index.php?occid=843829
846970	NY	W. R. Buck	Utah	Summit Co.	0.06	outside_boundary_exact	684179	40.6580556,-110.9463889	Utah, Summit County	Unita Mountains, Wasatch National Forest, Provo River Falls, W of UT 150	https://lichenportal.org/portal/collections/individual/index.php?occid=846970
